{
  "$schema": "https://json-schema.org/draft/2020-12/schema",
  "$id": "https://ait.example/schemas/ait-transcript-credential.v2.schema.json",
  "title": "AIT Student Academic Transcript (AitTranscriptCredential), schema v2, for transcript context v1",
  "description": "The AIT Student Academic Transcript as a W3C Verifiable Credential, Data Model 2.0, JSON-LD (ldp_vc), as the Issuer signs it with transcript context v1 (vc-lab/contexts/transcript/v1.json, served at {vdr}/contexts/transcript/v1.json). Under that context every credentialSubject claim is covered by the issuer signature: each claim is a top-level term and an untyped string, except courses, which is a JSON literal (@json) signed as one value. Changes from schema v1.1: Data Model 2.0 (validFrom, validUntil, credentialStatus), the context v1 URL in @context, and no courseTableHtml. Every value is a string, numbers included, inside courses as well as outside it; dates are ISO 8601 (YYYY-MM-DD) strings with no datatype. See ait-transcript-credential.v2.example.json, whose proof is illustrative and does not verify; the context and its rules are described in wiki/concepts/transcript-context.md.",
  "type": "object",
  "required": ["@context", "id", "type", "issuer", "validFrom", "validUntil", "credentialStatus", "credentialSubject", "proof"],
  "properties": {
    "@context": {
      "description": "JSON-LD contexts: VCDM 2.0, then AIT transcript context v1 (terms under https://ait.example/transcript#), then the Ed25519Signature2020 suite context. Locally the context URL is http://host.docker.internal:9098/contexts/transcript/v1.json; a public deployment names the api. gateway instead. Only the path's version names which context the credential was signed with.",
      "type": "array",
      "prefixItems": [
        { "const": "https://www.w3.org/ns/credentials/v2" },
        { "type": "string", "pattern": "/contexts/transcript/v1\\.json$", "description": "AIT transcript context v1, e.g. http://host.docker.internal:9098/contexts/transcript/v1.json" },
        { "const": "https://w3id.org/security/suites/ed25519-2020/v1" }
      ],
      "minItems": 3,
      "items": { "type": "string" }
    },
    "id": {
      "description": "Credential identifier: https://ait.example/credential/ followed by a UUID.",
      "type": "string",
      "format": "uri",
      "pattern": "^https://ait\\.example/credential/"
    },
    "type": {
      "type": "array",
      "items": { "type": "string" },
      "allOf": [
        { "contains": { "const": "VerifiableCredential" } },
        { "contains": { "const": "AitTranscriptCredential" } }
      ]
    },
    "issuer": {
      "description": "The AIT University Registrar's DID (did:key in the demo; its public key is the DID itself).",
      "type": "string",
      "pattern": "^did:"
    },
    "validFrom": { "description": "Issuance time of this credential (UTC).", "type": "string", "format": "date-time" },
    "validUntil": { "description": "Expiry of this credential (UTC). The demo issuer sets two years after validFrom.", "type": "string", "format": "date-time" },
    "credentialStatus": {
      "description": "The credential's revocation entry in Certify's Bitstring status list.",
      "type": "object",
      "required": ["id", "type", "statusPurpose", "statusListIndex", "statusListCredential"],
      "properties": {
        "id": { "type": "string", "format": "uri" },
        "type": { "const": "BitstringStatusListEntry" },
        "statusPurpose": { "const": "revocation" },
        "statusListIndex": { "type": "string", "pattern": "^[0-9]+$" },
        "statusListCredential": { "type": "string", "format": "uri" }
      }
    },
    "credentialSubject": { "$ref": "#/$defs/transcript" },
    "proof": {
      "description": "Issuer signature over the credential, canonicalized with URDNA2015.",
      "type": "object",
      "required": ["type", "created", "proofPurpose", "verificationMethod", "proofValue"],
      "properties": {
        "type": { "const": "Ed25519Signature2020" },
        "created": { "type": "string", "format": "date-time" },
        "proofPurpose": { "const": "assertionMethod" },
        "verificationMethod": { "type": "string", "description": "Issuer DID URL of the signing key." },
        "proofValue": { "type": "string", "pattern": "^z", "description": "Multibase (base58btc) Ed25519 signature." }
      }
    }
  },
  "$defs": {
    "date": { "type": "string", "pattern": "^[0-9]{4}-[0-9]{2}-[0-9]{2}$" },
    "decimal": { "type": "string", "pattern": "^[0-9]+(\\.[0-9]+)?$" },
    "transcript": {
      "title": "Transcript subject (the student and the degree)",
      "type": "object",
      "required": [
        "id", "fullName", "dateOfBirth", "country", "registrationNo", "previousDegree", "yearAwarded",
        "dateAdmitted", "option", "degreeAwarded", "dateGraduation", "faculty", "academicProgram",
        "areaOfSpecialization", "notes", "issueDate", "courses", "courseList",
        "thesisTitle", "thesisGrade", "programCommittee", "courseworkCredits", "thesisCredits",
        "totalCredits", "thesisExamination"
      ],
      "additionalProperties": false,
      "properties": {
        "id": {
          "description": "The holder: the student's wallet key as a did:jwk (bound at issuance). Not a student number.",
          "type": "string",
          "pattern": "^did:jwk:"
        },
        "fullName": {
          "description": "Student's full name as one string (not split into given, middle and family names), e.g. \"Sila N Mahoot\".",
          "type": "string"
        },
        "dateOfBirth": { "description": "Date of birth.", "$ref": "#/$defs/date" },
        "country": {
          "description": "Student's country, as a name (not an ISO code), e.g. \"Thailand\".",
          "type": "string"
        },
        "registrationNo": {
          "description": "AIT student number for this degree, e.g. \"st125001\". A student with two degrees has two numbers and two transcripts.",
          "type": "string"
        },
        "previousDegree": {
          "description": "Previous degree and awarding institution, free text, e.g. \"B.Eng Computer Engineering, Kasetsart University\".",
          "type": "string"
        },
        "yearAwarded": { "description": "Year the previous degree was awarded (YYYY).", "type": "string", "pattern": "^[0-9]{4}$" },
        "dateAdmitted": { "description": "Date admitted to AIT for this degree.", "$ref": "#/$defs/date" },
        "option": { "description": "Programme option, e.g. \"Thesis\".", "type": "string" },
        "degreeAwarded": { "description": "Degree name, e.g. \"Master of Engineering\", \"Doctor of Philosophy\".", "type": "string" },
        "dateGraduation": { "description": "Graduation date.", "$ref": "#/$defs/date" },
        "faculty": { "description": "School (faculty) name, e.g. \"School of Engineering and Technology\".", "type": "string" },
        "academicProgram": { "description": "Programme name, e.g. \"M.Eng Computer Science\".", "type": "string" },
        "areaOfSpecialization": { "description": "Area of specialization, e.g. \"Distributed Systems\".", "type": "string" },
        "notes": { "description": "Remarks on the transcript; \"-\" when there are none.", "type": "string" },
        "issueDate": { "description": "Issue date printed on the transcript (the document's date, not the credential's validFrom).", "$ref": "#/$defs/date" },
        "courses": {
          "description": "The course record, one entry per semester (term), in order. A JSON literal under context v1: signed as one value, so a change to any value inside it fails verification. Keys are plain ASCII and every value is a string.",
          "type": "array",
          "items": { "$ref": "#/$defs/term" }
        },
        "courseList": {
          "description": "Presentation only: one line per course, \"<title> — <grade>\", lines separated by \\n. Derived from courses; what a wallet card and the PDF show.",
          "type": "string"
        },
        "thesisTitle": { "description": "Thesis title.", "type": "string" },
        "thesisGrade": { "description": "Thesis grade, e.g. \"A\".", "type": "string" },
        "programCommittee": {
          "description": "Programme (thesis) committee members, one per line (lines separated by \\n), chair first with \"(Chair)\".",
          "type": "string"
        },
        "courseworkCredits": { "description": "Total coursework credits, e.g. \"27.0\".", "$ref": "#/$defs/decimal" },
        "thesisCredits": { "description": "Thesis credits, e.g. \"22.0\".", "$ref": "#/$defs/decimal" },
        "totalCredits": { "description": "Total credits (coursework + thesis), e.g. \"49.0\".", "$ref": "#/$defs/decimal" },
        "thesisExamination": { "description": "Thesis examination result, e.g. \"Passed\".", "type": "string" }
      }
    },
    "term": {
      "title": "Semester",
      "type": "object",
      "required": ["term", "courses", "credits", "gpa", "cumGpa"],
      "additionalProperties": false,
      "properties": {
        "term": { "description": "Semester name, e.g. \"August Semester 2024\".", "type": "string" },
        "courses": { "type": "array", "items": { "$ref": "#/$defs/course" } },
        "credits": { "description": "Credits taken in this semester.", "$ref": "#/$defs/decimal" },
        "gpa": { "description": "Semester GPA (4.00 scale).", "$ref": "#/$defs/decimal" },
        "cumGpa": { "description": "Cumulative GPA at the end of this semester.", "$ref": "#/$defs/decimal" }
      }
    },
    "course": {
      "title": "Course taken",
      "type": "object",
      "required": ["no", "title", "lec", "lab", "credits", "grade"],
      "additionalProperties": false,
      "properties": {
        "no": { "description": "Course code, e.g. \"CS601\".", "type": "string" },
        "title": { "description": "Course title.", "type": "string" },
        "lec": { "description": "Lecture hours.", "$ref": "#/$defs/decimal" },
        "lab": { "description": "Lab hours.", "$ref": "#/$defs/decimal" },
        "credits": { "description": "Credits.", "$ref": "#/$defs/decimal" },
        "grade": { "description": "Letter grade, e.g. \"A\", \"B+\".", "type": "string" }
      }
    }
  }
}
