{
  "@context": [
    "https://www.w3.org/ns/credentials/v2",
    "http://host.docker.internal:9098/contexts/transcript/v1.json",
    "https://w3id.org/security/suites/ed25519-2020/v1"
  ],
  "id": "https://ait.example/credential/dcd68410-875b-48d7-9c83-d2eee3bece5f",
  "type": [
    "VerifiableCredential",
    "AitTranscriptCredential"
  ],
  "issuer": "did:key:z6MkqFYtP99jdVRu18ms6eG9ho8Qm2aHenkjPn6uQLUsGtU7",
  "validFrom": "2026-10-01T09:00:00.000Z",
  "validUntil": "2028-09-30T09:00:00.000Z",
  "credentialStatus": {
    "id": "http://certify-nginx/v1/certify/credentials/status-list/5f0e8a9c-1b2d-4c3e-9f4a-6b7c8d9e0f1a#42",
    "type": "BitstringStatusListEntry",
    "statusPurpose": "revocation",
    "statusListIndex": "42",
    "statusListCredential": "http://certify-nginx/v1/certify/credentials/status-list/5f0e8a9c-1b2d-4c3e-9f4a-6b7c8d9e0f1a"
  },
  "credentialSubject": {
    "id": "did:jwk:eyJrdHkiOiJFQyIsInVzZSI6InNpZyIsImNydiI6IlAtMjU2IiwieCI6ImwyRWZ6MEZabXdDTEpEeU54Nl8yQlNQSjBEaXNXOUNwTWxIR3lNYkVzekkiLCJ5IjoiMmEzWnBOZXB3MDVPUlgyRjZhQktNamltQkF2TjZuS3h5a1Zxa3JIWTM2dyIsImFsZyI6IkVTMjU2In0=",
    "fullName": "Sila N Mahoot",
    "dateOfBirth": "1998-04-12",
    "country": "Thailand",
    "registrationNo": "st125001",
    "previousDegree": "B.Eng Computer Engineering, Kasetsart University",
    "yearAwarded": "2023",
    "dateAdmitted": "2024-08-19",
    "option": "Thesis",
    "degreeAwarded": "Master of Engineering",
    "dateGraduation": "2026-08-31",
    "faculty": "School of Engineering and Technology",
    "academicProgram": "M.Eng Computer Science",
    "areaOfSpecialization": "Distributed Systems",
    "notes": "-",
    "issueDate": "2026-09-17",
    "courses": [
      {
        "term": "August Semester 2024",
        "courses": [
          {
            "no": "CS601",
            "title": "Advanced Algorithms",
            "lec": "45",
            "lab": "0",
            "credits": "3",
            "grade": "A"
          },
          {
            "no": "CS602",
            "title": "Machine Learning",
            "lec": "30",
            "lab": "45",
            "credits": "3",
            "grade": "A-"
          },
          {
            "no": "CS603",
            "title": "Distributed Systems",
            "lec": "30",
            "lab": "45",
            "credits": "3",
            "grade": "B+"
          }
        ],
        "credits": "9",
        "gpa": "3.67",
        "cumGpa": "3.67"
      },
      {
        "term": "January Semester 2025",
        "courses": [
          {
            "no": "CS604",
            "title": "Computer Vision",
            "lec": "30",
            "lab": "45",
            "credits": "3",
            "grade": "A"
          },
          {
            "no": "CS605",
            "title": "Cryptography and Network Security",
            "lec": "45",
            "lab": "0",
            "credits": "3",
            "grade": "A"
          },
          {
            "no": "CS606",
            "title": "Cloud Computing",
            "lec": "30",
            "lab": "45",
            "credits": "3",
            "grade": "A-"
          }
        ],
        "credits": "9",
        "gpa": "3.89",
        "cumGpa": "3.78"
      }
    ],
    "courseList": "Advanced Algorithms — A\nMachine Learning — A-\nDistributed Systems — B+\nComputer Vision — A\nCryptography and Network Security — A\nCloud Computing — A-",
    "thesisTitle": "Verifiable Credential Issuance for Federated Academic Records",
    "thesisGrade": "A",
    "programCommittee": "Prof. Kittipong Wongsathan (Chair)\nDr. Nathas Tirawattanakul\nDr. Priya Ramaswamy",
    "courseworkCredits": "27.0",
    "thesisCredits": "22.0",
    "totalCredits": "49.0",
    "thesisExamination": "Passed"
  },
  "proof": {
    "type": "Ed25519Signature2020",
    "created": "2026-10-01T09:00:00Z",
    "proofPurpose": "assertionMethod",
    "verificationMethod": "did:key:z6MkqFYtP99jdVRu18ms6eG9ho8Qm2aHenkjPn6uQLUsGtU7#z6MkqFYtP99jdVRu18ms6eG9ho8Qm2aHenkjPn6uQLUsGtU7",
    "proofValue": "z5rvabSowc6brfNtatb3aYfbStjmBzjHjCj4PJsceyZ6Q5Mncy84pQHxBN5KafLdEnZd66ByHgHjNsDVngjtKrSkU"
  }
}
